Authors,Author(s) ID,Title,Year,Source title,Volume,Issue,Art. No.,Page start,Page end,Page count,Cited by,DOI,Link,Abstract,Document Type,Publication Stage,Open Access,Source,EID;;;;;;;;;
"Al sari B., Alkhaldi R., Alsaffar D., Alkhaldi T., Almaymuni H., Alnaim N., Alghamdi N., Olatunji S.O.,""57468788700";57468017200;57211990673;56105617200;57468327300;57207982651;57195557618;35520220400;",Sentiment analysis for cruises in Saudi Arabia on social media platforms using machine learning algorithms"",2022,""Journal of Big Data"",""9"",""1"",""21"","""","""",,,""10.1186/s40537-022-00568-5"",""https://www.scopus.com/inward/record.uri?eid=2-s2.0-85125304858&doi=10.1186%2fs40537-022-00568-5&partnerID=40&md5=e05384be55bd0a9a3d6cd4d8b9f5bcf0"",""Social media﻿ has great importance in the community for discussing many events and sharing them with others. The primary goal of this research is to study the quality of the sentiment analysis (SA) of impressions about Saudi cruises, as a first event, by creating datasets from three selected social media platforms (Instagram, Snapchat, and Twitter). The outcome of this study will help in understanding opinions of passengers and viewers about their first Saudi cruise experiences by analyzing their feelings from social media posts. After cleaning, this experiment contains 1200 samples. The data was classified into positive or negative classes using the choice of machine learning algorithms, such as multilayer perceptron (MLP), naıve bayes (NB), random forest (RF), support vector machine (SVM), and voting. The results show the highest classification accuracy for the RF algorithm, as it achieved 100% accuracy with over-sampled data from Snapchat using both test options. The algorithms were compared among the three different datasets. All algorithms achieved a high level of accuracy. Hence, the results show that 80% of the sentiments were positive while 20% were negative. © 2022, The Author(s)."",Article,""Final"",""All Open Access, Gold, Green"",Scopus,2-s2.0-85125304858";
"Fudolig M.I., Alshaabi T., Arnold M.V., Danforth C.M., Dodds P.S.,""56296933700";57214781899;57211028084;12808716500;7005561192;",Sentiment and structure in word co-occurrence networks on Twitter"",2022,""Applied Network Science"",""7"",""1"",""9"","""","""",,,""10.1007/s41109-022-00446-2"",""https://www.scopus.com/inward/record.uri?eid=2-s2.0-85124939698&doi=10.1007%2fs41109-022-00446-2&partnerID=40&md5=6abd8ca79e267dbc0d7718e4b845eda2"",""We explore the relationship between context and happiness scores in political tweets using word co-occurrence networks, where nodes in the network are the words, and the weight of an edge is the number of tweets in the corpus for which the two connected words co-occur. In particular, we consider tweets with hashtags #imwithher and #crookedhillary, both relating to Hillary Clinton’s presidential bid in 2016. We then analyze the network properties in conjunction with the word scores by comparing with null models to separate the effects of the network structure and the score distribution. Neutral words are found to be dominant and most words, regardless of polarity, tend to co-occur with neutral words. We do not observe any score homophily among positive and negative words. However, when we perform network backboning, community detection results in word groupings with meaningful narratives, and the happiness scores of the words in each group correspond to its respective theme. Thus, although we observe no clear relationship between happiness scores and co-occurrence at the node or edge level, a community-centric approach can isolate themes of competing sentiments in a corpus. © 2022, The Author(s)."",Article,""Final"",""All Open Access, Gold, Green"",Scopus,2-s2.0-85124939698";;;;
"Rivas R., Paul S., Hristidis V., Papalexakis E.E., Roy-Chowdhury A.K.,""57188680266";57218450946;6507537461;36987222700;57224916062;",Task-agnostic representation learning of multimodal twitter data for downstream applications"",2022,""Journal of Big Data"",""9"",""1"",""18"","""","""",,,""10.1186/s40537-022-00570-x"",""https://www.scopus.com/inward/record.uri?eid=2-s2.0-85124827436&doi=10.1186%2fs40537-022-00570-x&partnerID=40&md5=212c03c972a3afed585fd4c2bf5cb008"",""Twitter is a frequent target for machine learning research and applications. Many problems, such as sentiment analysis, image tagging, and location prediction have been studied on Twitter data. Much of the prior work that addresses these problems within the context of Twitter focuses on a subset of the types of data available, e.g. only text, or text and image. However, a tweet can have several additional components, such as the location and the author, that can also provide useful information for machine learning tasks. In this work, we explore the problem of jointly modeling several tweet components in a common embedding space via task-agnostic representation learning, which can then be used to tackle various machine learning applications. To address this problem, we propose a deep neural network framework that combines text, image, and graph representations to learn joint embeddings for 5 tweet components: body, hashtags, images, user, and location. In our experiments, we use a large dataset of tweets to learn a joint embedding model and use it in multiple tasks to evaluate its performance vs. state-of-the-art baselines specific to each task. Our results show that our proposed generic method has similar or superior performance to specialized application-specific approaches, including accuracy of 52.43% vs. 48.88% for location prediction and recall of up to 15.93% vs. 12.12% for hashtag recommendation. © 2022, The Author(s)."",Article,""Final"",""All Open Access, Gold"",Scopus,2-s2.0-85124827436";;;;
"Mameli M., Paolanti M., Morbidoni C., Frontoni E., Teti A.,""57208746001";57188734162;15136812700;9737451300;55382384600;",Social media analytics system for action inspection on social networks"",2022,""Social Network Analysis and Mining"",""12"",""1"",""33"","""","""",,,""10.1007/s13278-021-00853-w"",""https://www.scopus.com/inward/record.uri?eid=2-s2.0-85124428930&doi=10.1007%2fs13278-021-00853-w&partnerID=40&md5=a805f5e0f648380f6cdfb915454af3c6"",""Social networks are increasingly used for discussing all kinds of topics, including those related to politics, serving as a virtual arena. Consequently, analysing online conversations, for example, to predict election outcomes, is becoming a popular and challenging research area. On social networking sites, citizens express themselves spontaneously regarding political topics, often driven by specific events in social life. Real-time analysis of social media can provide valuable feedback and insights to both politicians and news agencies. In this paper, we discuss the design and implementation of a system for tracking and analysing social media. The SocMINT system provides an easy-to-use, visual dashboard to monitor the discussion on specific topics, to capture trends in communities and, by iteratively applying multidimensional data analysis and filtering, to deeply analyse posts and influencers. SocMINT aggregates data from multiple social sources and performs sentiment analysis on textual, visual and mixed content via a specifically designed neural network architecture. The system was applied in a real context by administrative staff of a political party to effectively analyse candidates’ political communication on Facebook, Instagram and Twitter and the related online community reactions and discussion. In the paper, we report on this real-world case study, showing how the system meaningfully captures trends in public opinion, comparing the main KPIs provided by SocMINT with the outcomes of traditional polls. © 2022, The Author(s), under exclusive licence to Springer-Verlag GmbH Austria, part of Springer Nature."",Article,""Final"",""All Open Access, Bronze, Green"",Scopus,2-s2.0-85124428930";;;;
"Ramadi K.B., Mehta R., He D., Chao S., Chu Z., Atun R., Nguyen F.T.,""57194234890";57425480900;57425338300;57426071600;56306250400;6602245046;56351052400;",Grass-roots entrepreneurship complements traditional top-down innovation in lung and breast cancer"",2022,""npj Digital Medicine"",""5"",""1"",""10"","""","""",,,""10.1038/s41746-021-00545-x"",""https://www.scopus.com/inward/record.uri?eid=2-s2.0-85123449036&doi=10.1038%2fs41746-021-00545-x&partnerID=40&md5=fe19b27c16eecd34df7513ff8a942d93"",""The majority of biomedical research is funded by public, governmental, and philanthropic grants. These initiatives often shape the avenues and scope of research across disease areas. However, the prioritization of disease-specific funding is not always reflective of the health and social burden of each disease. We identify a prioritization disparity between lung and breast cancers, whereby lung cancer contributes to a substantially higher socioeconomic cost on society yet receives significantly less funding than breast cancer. Using search engine results and natural language processing (NLP) of Twitter tweets, we show that this disparity correlates with enhanced public awareness and positive sentiment for breast cancer. Interestingly, disease-specific venture activity does not correlate with funding or public opinion. We use outcomes from recent early-stage innovation events focused on lung cancer to highlight the complementary mechanism by which bottom-up “grass-roots” initiatives can identify and tackle under-prioritized conditions. © 2022, The Author(s)."",Article,""Final"",""All Open Access, Gold, Green"",Scopus,2-s2.0-85123449036";;
"Singh A., Glińska-Neweś A.,""57193264185";36020019100;",Modeling the public attitude towards organic foods: a big data and text mining approach"",2022,""Journal of Big Data"",""9"",""1"",""2"","""","""",,,""10.1186/s40537-021-00551-6"",""https://www.scopus.com/inward/record.uri?eid=2-s2.0-85122543553&doi=10.1186%2fs40537-021-00551-6&partnerID=40&md5=441003ff6db17d98ca0b5f3723dc4084"",""This study aims to identify the topics that users post on Twitter about organic foods and to analyze the emotion-based sentiment of those tweets. The study addresses a call for an application of big data and text mining in different fields of research, as well as proposes more objective research methods in studies on food consumption. There is a growing interest in understanding consumer choices for foods which are caused by the predominant contribution of the food industry to climate change. So far, customer attitudes towards organic food have been studied mostly with self-reported methods, such as questionnaires and interviews, which have many limitations. Therefore, in the present study, we used big data and text mining techniques as more objective methods to analyze the public attitude about organic foods. A total of 43,724 Twitter posts were extracted with streaming Application Programming Interface (API). Latent Dirichlet Allocation (LDA) algorithm was applied for topic modeling. A test of topic significance was performed to evaluate the quality of the topics. Public sentiment was analyzed based on the NRC emotion lexicon by utilizing Syuzhet package. Topic modeling results showed that people discuss on variety of themes related to organic foods such as plant-based diet, saving the planet, organic farming and standardization, authenticity, and food delivery, etc. Sentiment analysis results suggest that people view organic foods positively, though there are also people who are skeptical about the claims that organic foods are natural and free from chemicals and pesticides. The study contributes to the field of consumer behavior by implementing research methods grounded in text mining and big data. The study contributes also to the advancement of research in the field of sustainable food consumption by providing a fresh perspective on public attitude toward organic foods, filling the gaps in existing literature and research. © 2021, The Author(s)."",Article,""Final"",""All Open Access, Gold, Green"",Scopus,2-s2.0-85122543553";;;;;;;
"Wunderlich F., Memmert D.,""57190607889";16039986900;",A big data analysis of Twitter data during premier league matches: do tweets contain information valuable for in-play forecasting of goals in football?"",2022,""Social Network Analysis and Mining"",""12"",""1"",""23"","""","""",,,""10.1007/s13278-021-00842-z"",""https://www.scopus.com/inward/record.uri?eid=2-s2.0-85122010136&doi=10.1007%2fs13278-021-00842-z&partnerID=40&md5=902afc5b4eac7828196eb978984040f3"",""Data-related analysis in football increasingly benefits from Big Data approaches and machine learning methods. One relevant application of data analysis in football is forecasting, which relies on understanding and accurately modelling the process of a match. The present paper tackles two neglected facets of forecasting in football: Forecasts on the total number of goals and in-play forecasting (forecasts based on within-match information). Sentiment analysis techniques were used to extract the information reflected in almost two million tweets from more than 400 Premier League matches. By means of wordclouds and timely analysis of several tweet-based features, the Twitter communication over the full course of matches and shortly before and after goals was visualized and systematically analysed. Moreover, several forecasting models including a random forest model have been used to obtain in-play forecasts. Results suggest that in-play forecasting of goals is highly challenging, and in-play information does not improve forecasting accuracy. An additional analysis of goals from more than 30,000 matches from the main European football leagues supports the notion that the predictive value of in-play information is highly limited compared to pre-game information. This is a relevant result for coaches, match analysts and broadcasters who should not overestimate the value of in-play information. The present study also sheds light on how the perception and behaviour of Twitter users change over the course of a football match. A main result is that the sentiment of Twitter users decreases when the match progresses, which might be caused by an unjustified high expectation of football fans before the match. © 2021, The Author(s)."",Article,""Final"",""All Open Access, Hybrid Gold, Green"",Scopus,2-s2.0-85122010136";;;;;;;
"Gupta I., Joshi N.,""57202092908";36052866600;",A Review on Negation Role in Twitter Sentiment Analysis"",2022,""International Journal of Healthcare Information Systems and Informatics"",""16"",""4"",,""1"",""19"",,,""10.4018/IJHISI.20211001.oa14"",""https://www.scopus.com/inward/record.uri?eid=2-s2.0-85122161466&doi=10.4018%2fIJHISI.20211001.oa14&partnerID=40&md5=c5c7c57629ed3a11f516a7cc1958d937"",""Negation is an important linguistic phenomenon that needs to be considered for identifying correct sentiments from the opinionated data available in digital form. It has the power to alter the polarity or strength of the polarity of affected words. In this paper, the authors present a survey on the negation role that has been done until now in sentiment analysis, specifically Twitter sentiment analysis. The authors discuss the various approaches of modelling negation in Twitter sentiment analysis. In particular, their focus is on negation scope detection and negation handling methods. This article also presents some of the challenges and limits of negation accounting in the field of Twitter sentiment analysis. © This article published as an Open Access article distributed under the terms of the Creative Commons Attribution License (http://creativecommons.org/licenses/by/4.0/) which permits unrestricted use, distribution, and production in any medium, provided the author of the original work and original publication source are properly credited."",Review,""Final"",""All Open Access, Bronze"",Scopus,2-s2.0-85122161466";;;;;;;
"Saquete E., Zubcoff J., Gutiérrez Y., Martínez-Barco P., Fernández J.,""6602658984";8837216500;41761666300;8927588100;55455049700;",Why are some social-media contents more popular than others? Opinion and association rules mining applied to virality patterns discovery"",2022,""Expert Systems with Applications"",""197"",,""116676"","""","""",,,""10.1016/j.eswa.2022.116676"",""https://www.scopus.com/inward/record.uri?eid=2-s2.0-85125238315&doi=10.1016%2fj.eswa.2022.116676&partnerID=40&md5=d0d11d2a94129b0f016bcf317d6bca0c"",""Discovering the main features of virality patterns in Twitter is the focus of this research. Five trending topics related to the COVID-19 pandemic were selected for the study, with Spanish as the target language. To carry out the discovery of virality patterns, we applied opinion mining techniques that enable us to structure the information based on the polarity of the messages and the emotions they contain. After transforming the information from an unstructured textual representation to a structured one, data mining techniques were applied, specifically association rules mining. Message patterns with the highest virality (high shares and high likes), and at the same time the most relevant characteristics of the patterns with less impact were extracted. After an exhaustive analysis of the most relevant non-redundant rules, it can be concluded that messages with a high-negative polarity and a very high emotional charge, especially emotions that have intensified with the COVID-19 pandemic, such as fear, sadness, anger and surprise are more likely to go viral in social media. By contrast, messages with little news coverage in the media, few authors, and the absence of surprise are relevant features when it comes to seeing messages with very low dissemination in social media. © 2022 The Authors"",Article,""Final"",""All Open Access, Hybrid Gold, Green"",Scopus,2-s2.0-85125238315";;;;
"Sunitha D., Patra R.K., Babu N.V., Suresh A., Gupta S.C.,""56252530400";36952253500;57660465200;57194525382;57213338255;",Twitter sentiment analysis using ensemble based deep learning model towards COVID-19 in India and European countries"",2022,""Pattern Recognition Letters"",""158"",,,""164"",""170"",,,""10.1016/j.patrec.2022.04.027"",""https://www.scopus.com/inward/record.uri?eid=2-s2.0-85129307152&doi=10.1016%2fj.patrec.2022.04.027&partnerID=40&md5=b971b5caa8c6e259dd6875bb6c4d1d47"",""As of November 2021, more than 24.80 crore people are diagnosed with the coronavirus in that around 50.20 lakhs people lost their lives, because of this infectious disease. By understanding the people's sentiment's expressed in their social media (Facebook, Twitter, Instagram etc.) helps their governments in controlling, monitoring, and eradicating the coronavirus. Compared to other social media's, the twitter data are indispensable in the extraction of useful awareness information related to any crisis. In this article, a sentiment analysis model is proposed to analyze the real time tweets, which are related to coronavirus. Initially, around 3100 Indian and European people's tweets are collected between the time period of 23.03.2020 to 01.11.2021. Next, the data pre-processing and exploratory investigation are accomplished for better understanding of the collected data. Further, the feature extraction is performed using Term Frequency-Inverse Document Frequency (TF-IDF), GloVe, pre-trained Word2Vec, and fast text embedding's. The obtained feature vectors are fed to the ensemble classifier (Gated Recurrent Unit (GRU) and Capsule Neural Network (CapsNet)) for classifying the user's sentiment's as anger, sad, joy, and fear. The obtained experimental outcomes showed that the proposed model achieved 97.28% and 95.20% of prediction accuracy in classifying the both Indian and European people's sentiments. © 2022 Elsevier B.V."",Article,""Final"",""All Open Access, Green"",Scopus,2-s2.0-85129307152";;;;
"Zheng H., Goh D.H.-L., Lee E.W.J., Lee C.S., Theng Y.-L.,""57202575475";7007069969;55585796800;16480371000;6602765593;",Understanding the effects of message cues on COVID-19 information sharing on Twitter"",2022,""Journal of the Association for Information Science and Technology"",""73"",""6"",,""847"",""862"",,,""10.1002/asi.24587"",""https://www.scopus.com/inward/record.uri?eid=2-s2.0-85117042538&doi=10.1002%2fasi.24587&partnerID=40&md5=68056b2e8e7d246f23fea735659e7b5f"",""Analyzing and documenting human information behaviors in the context of global public health crises such as the COVID-19 pandemic are critical to informing crisis management. Drawing on the Elaboration Likelihood Model, this study investigates how three types of peripheral cues—content richness, emotional valence, and communication topic—are associated with COVID-19 information sharing on Twitter. We used computational methods, combining Latent Dirichlet Allocation topic modeling with psycholinguistic indicators obtained from the Linguistic Inquiry and Word Count dictionary to measure these concepts and built a research model to assess their effects on information sharing. Results showed that content richness was negatively associated with information sharing. Tweets with negative emotions received more user engagement, whereas tweets with positive emotions were less likely to be disseminated. Further, tweets mentioning advisories tended to receive more retweets than those mentioning support and news updates. More importantly, emotional valence moderated the relationship between communication topics and information sharing—tweets discussing news updates and support conveying positive sentiments led to more information sharing";" tweets mentioning the impact of COVID-19 with negative emotions triggered more sharing. Finally, theoretical and practical implications of this study are discussed in the context of global public health communication. © 2021 Association for Information Science and Technology."",Article,""Final"",""All Open Access, Bronze, Green"",Scopus,2-s2.0-85117042538";;;
"Vukmirovic M., Raspopovic Milic M., Jovic J.,""55174564900";57660866600;57225909570;",Twitter Data Mining to Map Pedestrian Experience of Open Spaces"",2022,""Applied Sciences (Switzerland)"",""12"",""9"",""4143"","""","""",,,""10.3390/app12094143"",""https://www.scopus.com/inward/record.uri?eid=2-s2.0-85129262474&doi=10.3390%2fapp12094143&partnerID=40&md5=ccb1c5cb1a2786e6432d082dcad6bbca"",""This research investigated the classification and visualisation of Twitter user-generated data. Twitter data were classified based on their sentiment relating to pedestrian experience of the quality of open spaces, based on their content. The research methodology for Twitter data collection, processing and analysis included five phases: data collection, data pre-processing, data classification, data visualisation and data analysis. The territorial focus was on Oxford Street, London, UK. Special attention was placed on the questions regarding the potential of using Twitter data for extracting relevant topics for the public space and investigating whether the sentiment for these topics can relate to urban design and improvement of pedestrian space. The proposed research model considered amount and relevance, its possibilities regarding the interpretation of the collected sample, the potential of the data for the purpose of the analysis of pedestrian space quality, the precision of sentiment determination and the usability of data in relation to a particular open public space. © 2022 by the authors. Licensee MDPI, Basel, Switzerland."",Article,""Final"",""All Open Access, Gold"",Scopus,2-s2.0-85129262474";;;;;;
"Sugumaran P., Uma A.B.B.K.,""57211089497";57614796000;",Real-time twitter data analytics of mental illness in COVID-19: sentiment analysis using deep neural network"",2022,""Indonesian Journal of Electrical Engineering and Computer Science"",""26"",""1"",,""560"",""567"",,,""10.11591/ijeecs.v26.i1.pp560-567"",""https://www.scopus.com/inward/record.uri?eid=2-s2.0-85128782979&doi=10.11591%2fijeecs.v26.i1.pp560-567&partnerID=40&md5=f6ac6448b37cd93c0e438a93d3091ee7"",""The World Health Organization (WHO) states that the COVID-19 epidemic is being treated as a pandemic, with thousands of individuals infected and dead worldwide. School and college students are suffering from their online classes without any physical activities. Working men and women are also suffering from their working situations, as lots of people have lost their jobs and unemployment rates have become high due to the pandemic, and people are also losing physical contact with other family members, friends, and colleagues. The main objective of the proposed model is to monitor and analyse the real-time Twitter data-related tweets, such as coronavirus mental illness that are commonly used while referencing the pandemic. We have compared three deep learning approaches to sentiment analysis and found them to be useful. The first deep learning technique is to use a basic recurrent neural network (RNN), and the second is to use a deep learning RRN with long short-term memory (LSTM), followed by a gated recurrent unit (GRU). The experiment results indicate that the recurrent neural network built using GRU has the maximum accuracy of 99.47% for positive, negative, and neutral words and statements in Twitter data. © 2022 Institute of Advanced Engineering and Science. All rights reserved."",Article,""Final"",""All Open Access, Gold"",Scopus,2-s2.0-85128782979";;;;;;;
