Authors,Author(s) ID,Title,Year,Source title,Volume,Issue,Art. No.,Page start,Page end,Page count,Cited by,DOI,Link,Abstract,Document Type,Publication Stage,Open Access,Source,EID;;;;;;;;;
"Boukabous M., Azizi M.,""57222400180";25929027100;",Crime prediction using a hybrid sentiment analysis approach based on the bidirectional encoder representations from transformers"",2022,""Indonesian Journal of Electrical Engineering and Computer Science"",""25"",""2"",,""1131"",""1139"",,4,""10.11591/ijeecs.v25.i2.pp1131-1139"",""https://www.scopus.com/inward/record.uri?eid=2-s2.0-85123555893&doi=10.11591%2fijeecs.v25.i2.pp1131-1139&partnerID=40&md5=ebd32aab6db61c5f23211dba0929035b"",""Sentiment analysis (SA) is widely used today in many areas such as crime detection (security intelligence) to detect potential security threats in real-time using social media platforms such as Twitter. The most promising techniques in sentiment analysis are those of deep learning (DL), particularly bidirectional encoder representations from transformers (BERT) in the field of natural language processing (NLP). However, employing the BERT algorithm to detect crimes requires a crime dataset labeled by the lexicon-based approach. In this paper, we used a hybrid approach that combines both lexicon-based and deep learning, with BERT as the DL model. We employed the lexicon-based approach to label our Twitter dataset with a set of normal and crime-related lexicons";" then, we used the obtained labeled dataset to train our BERT model. The experimental results show that our hybrid technique outperforms existing approaches in several metrics, with 94.91% and 94.92% in accuracy and F1-score respectively. © 2022 Institute of Advanced Engineering and Science. All rights reserved."",Article,""Final"",""All Open Access, Gold"",Scopus,2-s2.0-85123555893";;;;;;
"Okango E., Mwambi H.,""56872894100";6506564852;",Dictionary Based Global Twitter Sentiment Analysis of Coronavirus (COVID-19) Effects and Response"",2022,""Annals of Data Science"",""9"",""1"",,""175"",""186"",,,""10.1007/s40745-021-00358-5"",""https://www.scopus.com/inward/record.uri?eid=2-s2.0-85123161249&doi=10.1007%2fs40745-021-00358-5&partnerID=40&md5=2f3688b54f028a9cb73f8c9d2f1fdf2a"",""In December 2019, a new pandemic called the coronavirus began ravaging the world. By May 2020, the pandemic had caused great loss of lives and disrupted the way of lives in more ways than one. The nature of the disease saw several strategies to curb its spread rolled out. These strategies included closing of businesses and borders, restriction of movements and working from home, mask mandate among others. With these measures and the effects, many individuals have taken to the social media to express their frustrations, opinions and how the pandemic is affecting them. This study employs dictionary based method for sentiment polarization from tweets related to coronavirus posted on Twitter. We also examine the co-occurrence of words to gain insights on the aspects affecting the masses. The results showed that mental health issues, lack of supplies were some of the direct effects of the pandemic. It was also clear that the COVID-19 prevention guidelines were well understood by those who tweeted. The results from this study may help governments combat the consequences of COVID-19 like mental health issues, lack of supplies e.g. food and also gauge the effectiveness or the reach of their guidelines. © 2021, The Author(s), under exclusive licence to Springer-Verlag GmbH Germany, part of Springer Nature."",Article,""Final"",""All Open Access, Bronze"",Scopus,2-s2.0-85123161249";;;;;;;
"Chandrasekaran G., Antoanela N., Andrei G., Monica C., Hemanth J.,""57224100705";24492087400;57418267300;57418267400;35100335700;",Visual Sentiment Analysis Using Deep Learning Models with Social Media Data"",2022,""Applied Sciences (Switzerland)"",""12"",""3"",""1030"","""","""",,,""10.3390/app12031030"",""https://www.scopus.com/inward/record.uri?eid=2-s2.0-85123110139&doi=10.3390%2fapp12031030&partnerID=40&md5=121164680189564c1dfa1af295ab6c8c"",""Analyzing the sentiments of people from social media content through text, speech, and images is becoming vital in a variety of applications. Many existing research studies on sentiment analysis rely on textual data, and similar to the sharing of text, users of social media share more photographs and videos. Compared to text, images are said to exhibit the sentiments in a much better way. So, there is an urge to build a sentiment analysis model based on images from social media. In our work, we employed different transfer learning models, including the VGG-19, ResNet50V2, and DenseNet-121 models, to perform sentiment analysis based on images. They were fine-tuned by freezing and unfreezing some of the layers, and their performance was boosted by applying regularization techniques. We used the Twitter-based images available in the Crowdflower dataset, which contains URLs of images with their sentiment polarities. Our work also presents a comparative analysis of these pre-trained models in the prediction of image sentiments on our dataset. The accuracies of our fine-tuned transfer learning models involving VGG-19, ResNet50V2, and DenseNet-121 are 0.73, 0.75, and 0.89, respectively. When compared to previous attempts at visual sentiment analysis, which used a variety of machine and deep learning techniques, our model had an improved accuracy by about 5% to 10%. According to the findings, the fine-tuned DenseNet-121 model outperformed the VGG-19 and ResNet50V2 models in image sentiment prediction. © 2022 by the authors. Licensee MDPI, Basel, Switzerland."",Article,""Final"",""All Open Access, Gold"",Scopus,2-s2.0-85123110139";;;;
"Garg N., Sharma K.,""57217069347";57171403000;",Text pre-processing of multilingual for sentiment analysis based on social network data"",2022,""International Journal of Electrical and Computer Engineering"",""12"",""1"",,""776"",""784"",,,""10.11591/ijece.v12i1.pp776-784"",""https://www.scopus.com/inward/record.uri?eid=2-s2.0-85118946472&doi=10.11591%2fijece.v12i1.pp776-784&partnerID=40&md5=0d474ba5b3dd01c87125f25195c722e5"",""Sentiment analysis (SA) is an enduring area for research especially in the field of text analysis. Text pre-processing is an important aspect to perform SA accurately. This paper presents a text processing model for SA, using natural language processing techniques for twitter data. The basic phases for machine learning are text collection, text cleaning, pre-processing, feature extractions in a text and then categorize the data according to the SA techniques. Keeping the focus on twitter data, the data is extracted in domain specific manner. In data cleaning phase, noisy data, missing data, punctuation, tags and emoticons have been considered. For pre-processing, tokenization is performed which is followed by stop word removal (SWR). The proposed article provides an insight of the techniques, that are used for text pre-processing, the impact of their presence on the dataset. The accuracy of classification techniques has been improved after applying text preprocessing and dimensionality has been reduced. The proposed corpus can be utilized in the area of market analysis, customer behaviour, polling analysis, and brand monitoring. The text pre-processing process can serve as the baseline to apply predictive analysis, machine learning and deep learning algorithms which can be extended according to problem definition. © This is an open access article under the CC BY-SA license."",Article,""Final"",""All Open Access, Gold, Green"",Scopus,2-s2.0-85118946472";;;;;;;
"Manikandan S., Dhanalakshmi P., Rajeswari K.C., Delphin Carolina Rani A.,""57226098005";24553765600;57212629738;57215613929;",Deep Sentiment Learning for Measuring Similarity Recommendations in Twitter Data"",2022,""Intelligent Automation and Soft Computing"",""34"",""1"",,""183"",""192"",,,""10.32604/iasc.2022.023469"",""https://www.scopus.com/inward/record.uri?eid=2-s2.0-85129093858&doi=10.32604%2fiasc.2022.023469&partnerID=40&md5=c77ad1cc738d4c3a54740e008ac3c22d"",""The similarity recommendation of twitter data is evaluated by using sentiment analysis method. In this paper, the deep learning processes such as classification, clustering and prediction are used to measure the data. Convolutional neural network is applied for analyzing multimedia contents which is received from various sources. Recurrent neural network is used for handling the natural language data. The content based recommendation system is proposed for selecting similarity index in twitter data using deep sentiment learning method. In this paper, sentiment analysis technique is used for finding similar images, contents, texts, etc. The content is selected based on repetitive comments and trending information. Hash tag is also considered for data collection and prediction. The number tweets are accountable and each character is taken for evaluation. Deep belief network is generated using 512 × 512 × 3 layers system and 1056 trained data, 512 test data that are taken for convolution process. The deep belief network is generated using TensorFlow. TensorFlow is used to simulate the deep learning environments. Semantic analysis is applied for handling Twitter Data. The deep learning processes are classified into clustering, regression and prediction that are evaluated by step by setup approach. The experiments are carried out using similarity index calculation and measuring of accuracy. The results of similarity recommendation are compared with existing method and the results are recorded. Our proposed system gives better results comparing with existing experiments. © 2022, Tech Science Press. All rights reserved."",Article,""Final"",""All Open Access, Hybrid Gold"",Scopus,2-s2.0-85129093858";;;;;
"Rodrigues A.P., Fernandes R., Aakash A., Abhishek B., Shetty A., Atul K., Lakshmanna K., Shafi R.M.,""57193609562";57193602654;57651975100;57655284100;57638055700;57651975200;56011347200;57208719868;",Real-Time Twitter Spam Detection and Sentiment Analysis using Machine Learning and Deep Learning Techniques"",2022,""Computational Intelligence and Neuroscience"",""2022"",,""5211949"","""","""",,,""10.1155/2022/5211949"",""https://www.scopus.com/inward/record.uri?eid=2-s2.0-85128801595&doi=10.1155%2f2022%2f5211949&partnerID=40&md5=c39af1a6874c4e2767933af28d0051b3"",""In this modern world, we are accustomed to a constant stream of data. Major social media sites like Twitter, Facebook, or Quora face a huge dilemma as a lot of these sites fall victim to spam accounts. These accounts are made to trap unsuspecting genuine users by making them click on malicious links or keep posting redundant posts by using bots. This can greatly impact the experiences that users have on these sites. A lot of time and research has gone into effective ways to detect these forms of spam. Performing sentiment analysis on these posts can help us in solving this problem effectively. The main purpose of this proposed work is to develop a system that can determine whether a tweet is """"spam""""or """"ham""""and evaluate the emotion of the tweet. The extracted features after preprocessing the tweets are classified using various classifiers, namely, decision tree, logistic regression, multinomial naïve Bayes, support vector machine, random forest, and Bernoulli naïve Bayes for spam detection. The stochastic gradient descent, support vector machine, logistic regression, random forest, naïve Bayes, and deep learning methods, namely, simple recurrent neural network (RNN) model, long short-term memory (LSTM) model, bidirectional long short-term memory (BiLSTM) model, and 1D convolutional neural network (CNN) model are used for sentiment analysis. The performance of each classifier is analyzed. The classification results showed that the features extracted from the tweets can be satisfactorily used to identify if a certain tweet is spam or not and create a learning model that will associate tweets with a particular sentiment. © 2022 Anisha P Rodrigues et al."",Article,""Final"",""All Open Access, Gold, Green"",Scopus,2-s2.0-85128801595";
"Sahmoud S., Abudalfa S., Elmasry W.,""55779714800";55258707100;57201775146;",AT-ODTSA: a Dataset of Arabic Tweets for Open Domain Targeted Sentiment Analysis"",2022,""International Journal of Computing and Digital Systems"",""11"",""1"",,""1299"",""1307"",,,""10.12785/ijcds/1101105"",""https://www.scopus.com/inward/record.uri?eid=2-s2.0-85128662648&doi=10.12785%2fijcds%2f1101105&partnerID=40&md5=d2e16cc86e2b3e23458108b450f9acc2"",""In the field of sentiment analysis, most of research has conducted experiments on datasets collected from Twitter for manipulating a specific language. Little number of datasets has been collected for detecting sentiments expressed in Arabic tweets. Moreover, very limited number of such datasets is suitable for conducting recent research directions such as target dependent sentiment analysis and open-domain targeted sentiment analysis. Thereby, there is a dire need for reliable datasets that are specifically acquired for open-domain targeted sentiment analysis with Arabic language. Therefore, in this paper, we introduce AT-ODTSA, a dataset of Arabic Tweets for Open-Domain Targeted Sentiment Analysis, which includes Arabic tweets along with labels that specify targets (topics) and sentiments (opinions) expressed in the collected tweets. To the best of our knowledge, our work presents the first dataset that manually annotated for applying Arabic open-domain targeted sentiment analysis. We also present a detailed statistical analysis of the dataset. The AT-ODTSA dataset is suitable for train numerous machine learning models such as a deep learning-based model. © 2022 University of Bahrain. All rights reserved."",Article,""Final"",""All Open Access, Gold"",Scopus,2-s2.0-85128662648";;;;;;
"Dumka A., Verma P., Singh R., Bisht A.K., Anand D., Aljahdali H.M., Noya I.D., Obregon S.A.,""56159612000";57204720597;57610169600;57608043000;57132370200;57192160630;57223334479;57607513500;",A Novel Deep Learning Based Healthcare Model for COVID-19 Pandemic Stress Analysis"",2022,""Computers, Materials and Continua"",""72"",""3"",,""6029"",""6044"",,,""10.32604/cmc.2022.024698"",""https://www.scopus.com/inward/record.uri?eid=2-s2.0-85128615235&doi=10.32604%2fcmc.2022.024698&partnerID=40&md5=aab8c2f564f0d5093fd152b51cdaadfa"",""Coronavirus (COVID-19) has impacted nearly every person across the globe either in terms of losses of life or as of lockdown. The current coronavirus (COVID-19) pandemic is a rare/special situation where people can express their feelings on Internet-based social networks. Social media is emerging as the biggest platform in recent years where people spend most of their time expressing themselves and their emotions. This research is based on gathering data from Twitter and analyzing the behavior of the people during the COVID-19 lockdown. The research is based on the logic expressed by people in this perspective and emotions for the suffering of COVID-19 and lockdown. In this research, we have used a Long Short-Term Memory (LSTM) network model with Convolutional Neural Network using Keras python deep-learning library to determine whether social media platform users are depressed in terms of positive, negative, or neutral emotional out bust based on their Twitter posts. The results showed that the model has 88.14% accuracy (representation of the correct prediction over the test dataset) after 10 epochs which most tweets showed had neutral polarity. The evaluation shows interesting results in positive (1), negative (-1), and neutral (0) emotions through different visualization. © 2022 Tech Science Press. All rights reserved."",Article,""Final"",""All Open Access, Gold"",Scopus,2-s2.0-85128615235";
"Hasan A., Sharma T., Khan A., Hasan Ali Al-Abyadh M.,""57604962000";57210012483;24537732600;57604458000;",Analysing Hate Speech against Migrants and Women through Tweets Using Ensembled Deep Learning Model"",2022,""Computational Intelligence and Neuroscience"",""2022"",,""8153791"","""","""",,,""10.1155/2022/8153791"",""https://www.scopus.com/inward/record.uri?eid=2-s2.0-85128553928&doi=10.1155%2f2022%2f8153791&partnerID=40&md5=8bca29d55748d19ed949f9b58e830f7f"",""Twitter's popularity has exploded in the previous few years, making it one of the most widely used social media sites. As a result of this development, the strategies described in this study are now more beneficial. Additionally, there has been an increase in the number of people who express their views in demeaning ways to others. As a result, hate speech has piqued interest in the subject of sentiment analysis, which has developed various algorithms for detecting emotions in social networks using intuitive means. This paper proposes the deep learning model to classify the sentiments in two separate analyses. In the first analysis, the tweets are classified based on the hate speech against the migrants and the women. In the second analysis, the detection is performed using a deep learning model to organise whether the hate speech is performed by a single or a group of users. During the text analysis, word embedding is implemented using the combination of deep learning models such as BiLSTM, CNN, and MLP. These models are integrated with word embedding methods such as inverse glove (global vector), document frequency (TF-IDF), and transformer-based embedding. © 2022 Asif Hasan et al."",Article,""Final"",""All Open Access, Gold, Green"",Scopus,2-s2.0-85128553928";;;;;
"Ansell L., Dalla Valle L.,""57204733507";57416535700;",Social Media Integration of Flood Data: A Vine Copula-Based Approach"",2022,""Journal of Environmental Informatics"",""39"",""2"",,""97"",""110"",,,""10.3808/jei.202200471"",""https://www.scopus.com/inward/record.uri?eid=2-s2.0-85128449644&doi=10.3808%2fjei.202200471&partnerID=40&md5=7bf79b5c3faa6977cb8b5b9ed6b56197"",""Floods are the most common and among the most severe natural disasters in many countries around the world. As global warming continues to exacerbate sea level rise and extreme weather, governmental authorities and environmental agencies are facing the pressing need of timely and accurate evaluations and predictions of flood risks. Current flood forecasts are generally based on historical measurements of environmental variables at monitoring stations. In recent years, in addition to traditional data sources, large amounts of information related to floods have been made available via social media. Members of the public are constantly and promptly posting information and updates on local environmental phenomena on social media platforms. Despite the growing interest of scholars towards the usage of online data during natural disasters, the majority of studies focus exclusively on social media as a stand-alone data source, while its joint use with other type of information is still unexplored. In this paper we propose to fill this gap by integrat ing traditional historical information on floods with data extracted by Twitter and Google Trends. Our methodology is based on vine copulas, that allow us to capture the dependence structure among the marginals, which are modelled via appropriate time series methods, in a very flexible way. We apply our methodology to data related to three different coastal locations on the South coast of the United Kingdom (UK). The results show that our approach, based on the integration of social media data, outperforms traditional methods in terms of evaluation and prediction of flood events. © 2022 ISEIS All rights reserved."",Article,""Final"",""All Open Access, Green"",Scopus,2-s2.0-85128449644";;;;;;;
"Balli C., Guzel M.S., Bostanci E., Mishra A.,""57579582000";36349844700;55364555800;7201441575;",Sentimental Analysis of Twitter Users from Turkish Content with Natural Language Processing"",2022,""Computational Intelligence and Neuroscience"",""2022"",,""2455160"","""","""",,,""10.1155/2022/2455160"",""https://www.scopus.com/inward/record.uri?eid=2-s2.0-85128410260&doi=10.1155%2f2022%2f2455160&partnerID=40&md5=7c75afd4fd8a3e12708dd8ab1614c9f8"",""Artificial Intelligence has guided technological progress in recent years";" it has shown significant development with increased academic studies on Machine Learning and the high demand for this field in the sector. In addition to the advancement of technology day by day, the pandemic, which has become a part of our lives since early 2020, has led to social media occupying a larger place in the lives of individuals. Therefore, social media posts have become an excellent data source for the field of sentiment analysis. The main contribution of this study is based on the Natural Language Processing method, which is one of the machine learning topics in the literature. Sentiment analysis classification is a solid example for machine learning tasks that belongs to human-machine interaction. It is essential to make the computer understand people emotional situation with classifiers. There are a limited number of Turkish language studies in the literature. Turkish language has different types of linguistic features from English. Since Turkish is an agglutinative language, it is challenging to make sentiment analysis with that language. This paper aims to perform sentiment analysis of several machine learning algorithms on Turkish language datasets that are collected from Twitter. In this research, besides using public dataset that belongs to Beyaz (2021) to get more general results, another dataset is created to understand the impact of the pandemic on people and to learn about public opinions. Therefore, a custom dataset, namely, SentimentSet (Balli 2021), was created, consisting of Turkish tweets that were filtered with words such as pandemic and corona by manually marking as positive, negative, or neutral. Besides, SentimentSet could be used in future researches as benchmark dataset. Results show classification accuracy of not only up to ∼87% with test data from datasets of both datasets and trained models, but also up to ∼84% with small """"Sample Test Data""""generated by the same methods as SentimentSet dataset. These research results contributed to indicating Turkish language specific sentiment analysis that is dependent on language specifications. © 2022 Cagla Balli et al."",Article,""Final"",""All Open Access, Gold, Green"",Scopus,2-s2.0-85128410260";;;;
"Umair A., Masciari E.,""57215223604";6506484045;",Sentimental and spatial analysis of COVID-19 vaccines tweets"",2022,""Journal of Intelligent Information Systems"",,,,"""","""",,,""10.1007/s10844-022-00699-4"",""https://www.scopus.com/inward/record.uri?eid=2-s2.0-85128209506&doi=10.1007%2fs10844-022-00699-4&partnerID=40&md5=a342329a01d1a3c97b037981e62047af"",""The world has to face health concerns due to huge spread of COVID. For this reason, the development of vaccine is the need of hour. The higher vaccine distribution, the higher the immunity against coronavirus. Therefore, there is a need to analyse the people’s sentiment for the vaccine campaign. Today, social media is the rich source of data where people share their opinions and experiences by their posts, comments or tweets. In this study, we have used the twitter data of vaccines of COVID and analysed them using methods of artificial intelligence and geo-spatial methods. We found the polarity of the tweets using the TextBlob() function and categorized them. Then, we designed the word clouds and classified the sentiments using the BERT model. We then performed the geo-coding and visualized the feature points over the world map. We found the correlation between the feature points geographically and then applied hotspot analysis and kernel density estimation to highlight the regions of positive, negative or neutral sentiments. We used precision, recall and F score to evaluate our model and compare our results with the state-of-the-art methods. The results showed that our model achieved 55% & 54% precision, 69% & 85% recall and 58% & 64% F score for positive class and negative class respectively. Thus, these sentimental and spatial analysis helps in world-wide pandemics by identify the people’s attitudes towards the vaccines. © 2022, The Author(s)."",Article,""Article in Press"",""All Open Access, Hybrid Gold, Green"",Scopus,2-s2.0-85128209506";;;;;;;
