Authors,Author(s) ID,Title,Year,Source title,Volume,Issue,Art. No.,Page start,Page end,Page count,Cited by,DOI,Link,Abstract,Document Type,Publication Stage,Open Access,Source,EID;;;;;;;;;
"Blekanov I.S., Tarasov N., Bodrunova S.S.,""56149559700";57205116335;56039882200;",Transformer-Based Abstractive Summarization for Reddit and Twitter: Single Posts vs. Comment Pools in Three Languages"",2022,""Future Internet"",""14"",""3"",""69"","""","""",,,""10.3390/fi14030069"",""https://www.scopus.com/inward/record.uri?eid=2-s2.0-85125624250&doi=10.3390%2ffi14030069&partnerID=40&md5=49411b535b555f39d844417fe6a5e78f"",""ive summarization is a technique that allows for extracting condensed meanings from long texts, with a variety of potential practical applications. Nonetheless, today’s abstractive summarization research is limited to testing the models on various types of data, which brings only marginal improvements and does not lead to massive practical employment of the method. In particular, abstractive summarization is not used for social media research, where it would be very useful for opinion and topic mining due to the complications that social media data create for other methods of textual analysis. Of all social media, Reddit is most frequently used for testing new neural models of text summarization on large-scale datasets in English, without further testing on real-world smaller-size data in various languages or from various other platforms. Moreover, for social media, summarizing pools of texts (one-author posts, comment threads, discussion cascades, etc.) may bring crucial results relevant for social studies, which have not yet been tested. However, the existing methods of abstractive summarization are not fine-tuned for social media data and have next-to-never been applied to data from platforms beyond Reddit, nor for comments or non-English user texts. We address these research gaps by fine-tuning the newest Transformer-based neural network models LongFormer and T5 and testing them against BART, and on real-world data from Reddit, with improvements of up to 2%. Then, we apply the best model (fine-tuned T5) to pools of comments from Reddit and assess the similarity of post and comment summarizations. Further, to overcome the 500-token limitation of T5 for analyzing social media pools that are usually bigger, we apply LongFormer Large and T5 Large to pools of tweets from a large-scale discussion on the Charlie Hebdo massacre in three languages and prove that pool summarizations may be used for detecting micro-shifts in agendas of networked discussions. Our results show, however, that additional learning is definitely needed for German and French, as the results for these languages are non-satisfactory, and more fine-tuning is needed even in English for Twitter data. Thus, we show that a ‘one-for-all’ neural-network summarization model is still impossible to reach, while fine-tuning for platform affordances works well. We also show that fine-tuned T5 works best for small-scale social media data, but LongFormer is helpful for larger-scale pool summarizations. © 2022 by the authors. Licensee MDPI, Basel, Switzerland."",Article,""Final"",""All Open Access, Gold, Green"",Scopus,2-s2.0-85125624250";;;;;;
"Waheeb S.A., Khan N.A., Shang X.,""57217175938";57215544693;34977565100;",Topic Modeling and Sentiment Analysis of Online Education in the COVID-19 Era Using Social Networks Based Datasets"",2022,""Electronics (Switzerland)"",""11"",""5"",""715"","""","""",,,""10.3390/electronics11050715"",""https://www.scopus.com/inward/record.uri?eid=2-s2.0-85125385493&doi=10.3390%2felectronics11050715&partnerID=40&md5=97a2fbecebaf742c907a3d1284e792a4"",""Sentiment Analysis (SA) is a technique to study people’s attitudes related to textual data generated from sources like Twitter. This study suggested a powerful and effective technique that can tackle the large contents and can specifically examine the attitudes, sentiments, and fake news of “E-learning”, which is considered a big challenge, as online textual data related to the education sector is considered of great importance. On the other hand, fake news and misinformation related to COVID-19 have confused parents, students, and teachers. An efficient detection approach should be used to gather more precise information in order to identify COVID-19 disinformation. Tweet records (people’s opinions) have gained significant attention worldwide for understanding the behaviors of people’s attitudes. SA of the COVID-19 education sector still does not provide a clear picture of the information available in these tweets, especially if this misinformation and fake news affect the field of E-learning. This study has proposed denoising AutoEncoder to eliminate noise in information, the attentional mechanism for a fusion of features as parts where a fusion of multi-level features and ELM-AE with LSTM is applied for the task of SA classification. Experiments show that our suggested approach obtains a higher F1-score value of 0.945, compared with different state-of-the-art approaches, with various sizes of testing and training datasets. Based on our knowledge, the proposed model can learn from unified features set to obtain good performance, better results than one that can be learned from the subset of features. © 2022 by the authors. Licensee MDPI, Basel, Switzerland."",Article,""Final"",""All Open Access, Gold"",Scopus,2-s2.0-85125385493";;;;;;
"Kayıkçı Ş.,""57205574405";",SenDemonNet: sentiment analysis for demonetization tweets using heuristic deep neural network"",2022,""Multimedia Tools and Applications"",""81"",""8"",,""11341"",""11378"",,,""10.1007/s11042-022-11929-w"",""https://www.scopus.com/inward/record.uri?eid=2-s2.0-85124762273&doi=10.1007%2fs11042-022-11929-w&partnerID=40&md5=5c68a98c3e7d9a97cf374ab8b56b6456"",""Sentiment analysis is one of the efficient models for extracting opinion mining with identification and classification from unstructured text data such as product reviews or microblogs. It is used to gain feedback from political campaigns, brand reviews, marketing analysis, and customers. The sentiment analysis on Twitter data is a recent research field in the natural processing. The dataset is gathered from the “Twitter” package in R along with Twitter API. The main intent of this paper is to understand the public opinion on the recently implemented demonetization policy using the proposed SenDemonNet. Initially, the tweet preprocessing was done, which is intended for cleaning the text data. Then, the feature extraction is performed by Bag of n-grams, TF-IDF, and the word2vec algorithm. The main objective of this work is a weighted feature selection that is developed by the hybrid Forest–Whale Optimization Algorithm (F-WOA) to get the best classification outcome. With these features, the Heuristic Deep Neural Network (HDNN) is adopted for classification, where the proposed FOA and WOA tune the parameter of DNN for reaching the maximum accuracy rate. From the statistical analysis, the performance of the designed F-WOA-DNN is 1.8%, 1.9%, 1.86%, and 2% enhanced than PSO-DNN, GWO-DNN, WOA-DNN, FOA-DNN, SVM, CNN, LSTM, and DNN respectively. Extensive experimental results show that SenDemonNet outperforms its competitors, producing an impressive increase in the classification accuracy on the benchmark dataset. Graphical abstract: [Figure not available: see fulltext.]. © 2022, The Author(s), under exclusive licence to Springer Science+Business Media, LLC, part of Springer Nature."",Article,""Final"",""All Open Access, Bronze, Green"",Scopus,2-s2.0-85124762273";;;;;;;;
"Rintyarna B.S., Kuswanto H., Sarno R., Rachmaningsih E.K., Rachman F.H., Suharso W., Cahyanto T.A.,""57191611739";36117960200;53264815700;57449139300;57210758099;57448917600;57449139400;",Modelling Service Quality of Internet Service Providers during COVID-19: The Customer Perspective Based on Twitter Dataset"",2022,""Informatics"",""9"",""1"",""11"","""","""",,,""10.3390/informatics9010011"",""https://www.scopus.com/inward/record.uri?eid=2-s2.0-85124483079&doi=10.3390%2finformatics9010011&partnerID=40&md5=fe508354d4370deb3aaa0f4df581b03f"",""Internet service providers (ISPs) conduct their business by providing Internet access features to their customers. The COVID-19 pandemic has shifted most activity being performed remotely using an Internet connection. As a result, the demand for Internet services increased by 50%. This significant rise in the appeal of Internet services needs to be overtaken by a notable increase in the service quality provided by ISPs. Service quality plays a great role for enterprises, including ISPs, in retaining consumer loyalty. Thus, modelling ISPs’ service quality is of great importance. Since a common technique to reveal service quality is a timely and costly pencil survey-based method, this work proposes a framework based on the Sentiment Analysis (SA) of the Twitter dataset to model service quality. The SA involves the majority voting of three machine learning algorithms namely Naïve Bayes, Multinomial Naïve Bayes and Bernoulli Naïve Bayes. Making use of Thaicon’s service quality metrics, this work proposes a formula to generate a rating of service quality accordingly. For the case studies, we examined two ISPs in Indonesia, i.e., By.U and MPWR. The framework successfully extracted the service quality rate of both ISPs, revealing that By.U is better in terms of service quality, as indicated by a service quality rate of 0.71. Meanwhile, MPWR outperforms By.U in terms of customer service. © 2022 by the authors. Licensee MDPI, Basel, Switzerland."",Article,""Final"",""All Open Access, Gold, Green"",Scopus,2-s2.0-85124483079";;
"Lepelaar M., Wahby A., Rossouw M., Nikitin L., Tibble K., Ryan P.J., Watson R.B.,""57427884700";57427775200;57428096000;57427884800;57427884900;57649818200;56972188800;",Sentiment Analysis of Social Survey Data for Local City Councils"",2022,""Journal of Sensor and Actuator Networks"",""11"",""1"",""7"","""","""",,,""10.3390/jsan11010007"",""https://www.scopus.com/inward/record.uri?eid=2-s2.0-85123517957&doi=10.3390%2fjsan11010007&partnerID=40&md5=33d940d127fd53d8426a06fc6ddcbee0"",""Big data analytics can be used by smart cities to improve their citizens’ liveability, health, and wellbeing. Social surveys and also social media can be employed to engage with their com-munities, and these can require sophisticated analysis techniques. This research was focused on carrying out a sentiment analysis from social surveys. Data analysis techniques using RStudio and Python were applied to several open-source datasets, which included the 2018 Social Indicators Survey dataset published by the City of Melbourne (CoM) and the Casey Next short survey 2016 dataset published by the City of Casey (CoC). The qualitative nature of the CoC dataset responses could produce rich insights using sentiment analysis, unlike the quantitative CoM dataset. RStudio analysis created word cloud visualizations and bar charts for sentiment values. These were then used to inform social media analysis via the Twitter application programming interface. The R codes were all integrated within a Shiny application to create a set of user-friendly interactive web apps that generate sentiment analysis both from the historic survey data and more immediately from the Twitter feeds. The web apps were embedded within a website that provides a customisable solution to estimate sentiment for key issues. Global sentiment was also compared between the social media approach and the 2016 survey dataset analysis and showed some correlation, although there are caveats on the use of social media for sentiment analysis. Further refinement of the methodology is required to improve the social media app and to calibrate it against analysis of recent survey data. © 2022 by the authors. Licensee MDPI, Basel, Switzerland. This article is an open access article distributed under the terms and conditions of the Creative Commons Attribution (CC BY) license (https:// creativecommons.org/licenses/by/ 4.0/)."",Article,""Final"",""All Open Access, Gold"",Scopus,2-s2.0-85123517957";;
"Allen D.E., McAleer M.,""7404328198";57221794286;",Trump’s COVID-19 tweets and Dr. Fauci’s emails"",2022,""Scientometrics"",""127"",""3"",,""1643"",""1655"",,,""10.1007/s11192-021-04243-z"",""https://www.scopus.com/inward/record.uri?eid=2-s2.0-85123122123&doi=10.1007%2fs11192-021-04243-z&partnerID=40&md5=24812f5aebee368941743acdc277afc0"",""The paper features an analysis of former President Trump’s early tweets on COVID-19 in the context of Dr. Fauci’s recently revealed email trove. The tweets are analysed using various data mining techniques, including sentiment analysis. These techniques facilitate exploration of content and sentiments within the texts, and their potential implications for the national and international reaction to COVID-19. The data set or corpus includes 159 tweets on COVID-19 that are sourced from the Trump Twitter Archive, running from 24 January 2020 to 2 April 2020. In addition we use Zipf and Mandelbrot’s power law to calibrate the extent to which they differ from normal language patterns. A context for the emails is provided by the recently revealed email trove of Dr. Fauci, obtained by Buzzfeed on 1 June 2021 obtained under the Freedom of Information Act. © 2022, Akadémiai Kiadó, Budapest, Hungary."",Letter,""Final"",""All Open Access, Bronze, Green"",Scopus,2-s2.0-85123122123";;;;;;;
"Feng Y., Zhou W.,""57195902826";55475954300;",Work from home during the COVID-19 pandemic: An observational study based on a large geo-tagged COVID-19 Twitter dataset (UsaGeoCov19)"",2022,""Information Processing and Management"",""59"",""2"",""102820"","""","""",,,""10.1016/j.ipm.2021.102820"",""https://www.scopus.com/inward/record.uri?eid=2-s2.0-85120971517&doi=10.1016%2fj.ipm.2021.102820&partnerID=40&md5=fa8221759e44557857c6f1bfa34c6ded"",""As COVID-19 swept over the world, people discussed facts, expressed opinions, and shared sentiments about the pandemic on social media. Since policies such as travel restriction and lockdown in reaction to COVID-19 were made at different levels of the society (e.g., schools and employers) and the government, we build a large geo-tagged Twitter dataset titled UsaGeoCov19 and perform an exploratory analysis by geographic location. Specifically, we collect 650,563 unique geo-tagged tweets across the United States covering the date range from January 25 to May 10, 2020. Tweet locations enable us to conduct region-specific studies such as tweeting volumes and sentiment, sometimes in response to local regulations and reported COVID-19 cases. During this period, many people started working from home. The gap between workdays and weekends in hourly tweet volumes inspire us to propose algorithms to estimate work engagement during the COVID-19 crisis. This paper also summarizes themes and topics of tweets in our dataset using both social media exclusive tools (i.e., #hashtags, @mentions) and the latent Dirichlet allocation model. We welcome requests for data sharing and conversations for more insights. UsaGeoCov19 link: http://yunhefeng.me/geo-tagged_twitter_datasets/. © 2021 Elsevier Ltd"",Article,""Final"",""All Open Access, Bronze, Green"",Scopus,2-s2.0-85120971517";;;;;;;
"Pal Nandi B., Jain A., Tayal D.K., Narang P.A.,""57209886987";55576323800;16640428000;57532457800;",High performing sentiment analysis based on fast Fourier transform over temporal intuitionistic fuzzy value"",2022,""Soft Computing"",""26"",""6"",,""3059"",""3073"",,1,""10.1007/s00500-021-06444-3"",""https://www.scopus.com/inward/record.uri?eid=2-s2.0-85119252278&doi=10.1007%2fs00500-021-06444-3&partnerID=40&md5=5ac769dfd69090f2f41c593257e5f7a1"",""Sentiment analysis or opinion mining has an extensive area in the field of research. Today we consider the huge amount of structured and unstructured data available in the web for a particular subject to get an opinion. The surplus data handling termed as big data requires some new technology to deal with. This paper considers the requirement of sentiment analysis of such huge data for fast processing. Based on fast Fourier transform on temporal intuitionistic fuzzy set generated from text, this algorithm (FFT–TIFS) expedites the sentiment classification. Fourier analysis converts a signal from its time domain to its representation in frequency domain. Such frequency domain algorithm on temporal intuitionistic fuzzy set is used in sentiment analysis for the first time. This algorithm is useful for short Twitter text, document-level as well as sentence-level binary sentiment classification. It is tested on aclImdb, Polarity, MR, Sentiment 140 and CR dataset which gives an average of 80% accuracy. The proposed method shows significant improvement in required time complexity where the method achieves 17 times faster processing in comparison with sequential fuzzy C-means (FCM) method, and again, it is at least 7 times faster than distributed FCM method present in the literature. The method presented in this paper has a novel approach towards fastest processing time and suitability of various sizes of the text sentiment analysis. © 2021, The Author(s), under exclusive licence to Springer-Verlag GmbH Germany, part of Springer Nature."",Article,""Final"",""All Open Access, Green"",Scopus,2-s2.0-85119252278";;;;;
"Kannan E., Kothamasu L.A.,""56452935100";57216866310;",Fine-Tuning BERT Based Approach for Multi-Class Sentiment Analysis on Twitter Emotion Data"",2022,""Ingenierie des Systemes d'Information"",""27"",""1"",,""93"",""100"",,,""10.18280/isi.270111"",""https://www.scopus.com/inward/record.uri?eid=2-s2.0-85128730803&doi=10.18280%2fisi.270111&partnerID=40&md5=af10aa7effa16761c689c424fcc628ae"",""Tweets are difficult to classify due to their simplicity and frequent use of non-standard orthodoxy or slang words. Although several studies have identified highly accurate sentiment data classifications, most have not been tested on Twitter data. Previous research on sentiment interpretation focused on binary or ternary sentiments in monolingual texts. However, emotions emerge in bilingual and multilingual texts. The emotions expressed in today's social media, including microblogs, are different. We use a dataset that combines everyday dialogue, easy and emotional stimulation to carry out the algorithm to create a balanced dataset with five labels: joy, sad, anger, fear, and neutral. This entails the preparation of datasets and conventional machine learning models. We categorized tweets using the Bidirectional Encoder Representations from Transformers (BERT) language model but are pre-trained in plain text instead of tweets using BERT Transfer Learning (TensorFlow Keras). In this paper we use the HuggingFace's transformers library to fine-tune pretrained BERT model for a classification task which is termed as modified (M-BERT). Our modified (M-BERT) model is an average F1-score of 97.63% in all of our taxonomy, which leaves more space for change, is our modified (M-BERT) model. We show that the dual use of an F1-score as a combination of M-BERT and Machine Learning methods increases classification accuracy by 24.92%. as related to baseline BERT model. © 2022 International Information and Engineering Technology Association. All rights reserved."",Article,""Final"",""All Open Access, Bronze"",Scopus,2-s2.0-85128730803";;;;;;;
"Chursook A., Dawod A.Y., Chanaim S., Naktnasukanjn N., Chakpitak N.,""57222705409";36617132500;56365497600;57203758408;6504671563;",Twitter Sentiment Analysis and Expert Ratings of Initial Coin Offering Fundraising: Evidence from Australia and Singapore Markets"",2022,""TEM Journal"",""11"",""1"",,""44"",""55"",,,""10.18421/TEM111-06"",""https://www.scopus.com/inward/record.uri?eid=2-s2.0-85125738470&doi=10.18421%2fTEM111-06&partnerID=40&md5=9669f0d2c8e218282d8c1b25fcf94028"",""Sentiment analysis of Twitter data is quite valuable for determining the market opinion. Twitter sentiment analysis is more challenging than generic sentiment analysis owing to slang and misspellings. The techniques utilized for evaluating the sentiment of tweets that have the greatest importance for the success of an Initial Coin Offering (ICO) are machine learning approaches. In this study, we examined market sentiment and used Expert Ratings to predict the success of ICOs in the Australian and Singapore markets. Based on 68,281 tweets from 57 ICOs across four industries: business services, cryptocurrency, entertainment, and platform. Several classification methods were investigated, including Support Vector Machines (SVMs), Logistic Regression (LR), Random Forest (RF), and Naïve Bayes (NB). The outcomes indicated that sentiment analysis of tweets and expert ratings may be used to forecast the success of an initial coin offering. The results indicate that the suggested model is capable of accurately assessing the tweets of the ICO Successful with a maximum accuracy of about 94.7 % when implementing the Support Vector Machines (SVMs) classifier. © 2022 Anchaya Chursook et al";" published by UIKTEN. This work is licensed under the Creative Commons Attribution-NonCommercial-NoDerivs 4.0 License."",Article,""Final"",""All Open Access, Gold"",Scopus,2-s2.0-85125738470";;;
"AlBadani B., Shi R., Dong J.,""57425348100";7102948095;56953930600;",A Novel Machine Learning Approach for Sentiment Analysis on Twitter Incorporating the Universal Language Model Fine-Tuning and SVM"",2022,""Applied System Innovation"",""5"",""1"",""13"","""","""",,2,""10.3390/asi5010013"",""https://www.scopus.com/inward/record.uri?eid=2-s2.0-85123821583&doi=10.3390%2fasi5010013&partnerID=40&md5=4e8b80e236875990c512aa9631e0cef0"",""Twitter sentiment detectors (TSDs) provide a better solution to evaluate the quality of service and product than other traditional technologies. The classification accuracy and detection performance of TSDs, which are extremely reliant on the performance of the classification techniques, are used, and the quality of input features is provided. However, the time required is a big problem for the existing machine learning methods, which leads to a challenge for all enterprises that aim to transform their businesses to be processed by automated workflows. Deep learning techniques have been utilized in several real-world applications in different fields such as sentiment analysis. Deep learning approaches use different algorithms to obtain information from raw data such as texts or tweets and represent them in certain types of models. These models are used to infer information about new datasets that have not been modeled yet. We present a new effective method of sentiment analysis using deep learning architectures by combining the “universal language model fine-tuning” (ULMFiT) with support vector machine (SVM) to increase the detection efficiency and accuracy. The method introduces a new deep learning approach for Twitter sentiment analysis to detect the attitudes of people toward certain products based on their comments. The extensive results on three datasets illustrate that our model achieves the state-of-the-art results over all datasets. For example, the accuracy performance is 99.78% when it is applied on the Twitter US Airlines dataset. © 2022 by the authors. Licensee MDPI, Basel, Switzerland."",Article,""Final"",""All Open Access, Gold, Green"",Scopus,2-s2.0-85123821583";;;;;;
"Alqurashi T.,""56241636200";",Stance Analysis of Distance Education in the Kingdom of Saudi Arabia during the COVID-19 Pandemic Using Arabic Twitter Data"",2022,""Sensors"",""22"",""3"",""1006"","""","""",,,""10.3390/s22031006"",""https://www.scopus.com/inward/record.uri?eid=2-s2.0-85123574953&doi=10.3390%2fs22031006&partnerID=40&md5=10544ac48a93f12fbcef1f2ae0f570af"",""The coronavirus has caused significant disruption to people’s everyday lives, altering how people live, work, and study. The Kingdom of Saudi Arabia (KSA) reacted very quickly to suppress the spread of the virus even before the first case of COVID-19 was confirmed in the country. In the education sector, all face-to-face activities at public and private schools and universities were suspended, as they switched from traditional to distance learning for the entire 2020 academic year. This study collected 1,846,285 tweets to analyze the public’s dynamic opinions towards distance education in the KSA during the 2020 academic year. Several classical machine-learning models and deep-learning models, including ensemble random forest (RF), support vector machine (SVM), adaptive boosting (AdaBoost), multinomial naïve Bayes (MNB), convolutional neural network (CNN), and long short-term memory (LSTM), were tested on this data, and the best-performing models were selected to analyze the public stance towards distance education. Additionally, I correlated my analysis with the major events that were announced by the Ministry of Education (MOE). I observed that people in the KSA took some time to react and express their stances at the start of the academic year. Regarding the news, I observed that any exam-related topic attracted high engagement. In-favor stances increased when news headlines covered the topic of exams compared to other topics. The results show that the primary Saudi public stance favored distance education during the 2020 academic year. © 2022 by the author. Licensee MDPI, Basel, Switzerland."",Article,""Final"",""All Open Access, Gold, Green"",Scopus,2-s2.0-85123574953";;;;;;;;
