Authors,Author(s) ID,Title,Year,Source title,Volume,Issue,Art. No.,Page start,Page end,Page count,Cited by,DOI,Link,Abstract,Document Type,Publication Stage,Open Access,Source,EID;;;;;;;;;
"Bahuguna A., Yadav D., Senapati A., Saha B.N.,""57575174200";57211312988;56152168000;23398278100;",A unified deep neuro-fuzzy approach for COVID-19 twitter sentiment classification"",2022,""Journal of Intelligent and Fuzzy Systems"",""42"",""5"",,""4587"",""4597"",,,""10.3233/JIFS-219247"",""https://www.scopus.com/inward/record.uri?eid=2-s2.0-85128205524&doi=10.3233%2fJIFS-219247&partnerID=40&md5=7400ece28f977d235df5733dd46afad3"",""Covid-19 braces serious mental health crisis across the world. Since a vast majority of the population exploit social media platforms such as twitter to exchange information, rapid collecting and analyzing social media data to understand personal well-being and subsequently adopting adequate measures could avoid severe socio-economic damage. Sentiment analysis on twitter data is very useful to understand and identify the mental health issues. In this research, we proposed a unified deep neuro-fuzzy approach for Covid-19 twitter sentiment classification. Fuzzy logic has been a very powerful tool for twitter data analysis where approximate semantic and syntactic analysis is more relevant because correcting spelling and grammar in tweets are merely obnoxious. We conducted the experiment on three challenging COVID-19 twitter sentiment datasets. Experimental results demonstrate that fuzzy Sugeno integral based ensembled classifiers succeed over individual base classifiers. © 2022 - IOS Press. All rights reserved."",Article,""Final"",""All Open Access, Bronze"",Scopus,2-s2.0-85128205524";;;;;
"Galende B.A., Hernandez-Penaloza G., Uribe S., Garcia F.A.,""57566611500";42261720800;35749354100;57626580200;",Conspiracy or Not? A Deep Learning Approach to Spot It on Twitter"",2022,""IEEE Access"",""10"",,,""38370"",""38378"",,,""10.1109/ACCESS.2022.3165226"",""https://www.scopus.com/inward/record.uri?eid=2-s2.0-85127753035&doi=10.1109%2fACCESS.2022.3165226&partnerID=40&md5=682103e897ae4a355b901dcf799d33f6"",""Sentiment analysis is an active topic in Natural Language Processing (NLP). It has attracted a significant interest of research community due to the wide range of applications, including social-media, fake news spotting and interactive applications. In this paper, we present a novel approach for semi-automatic background creation and conspiracy classification. For this purpose, a complete framework including novel recurrent models is proposed. The BORJIS: Best algorithm foR Joint conspiracy and sarcasm detection has been tested on twitter-crawled data and It is composed by: (a) the crawler and labelling module, (b) the features vector extraction and (c) the conspiracy classifier. BORJIS was compared with up-to-date techniques and it showed a significant improvement (≥ 10% accuracy) when applied to diverse datasets. © 2013 IEEE."",Article,""Final"",""All Open Access, Gold"",Scopus,2-s2.0-85127753035";;;;;
"Razzaq A., Abbas T., Hashim S., Qadri S., Mumtaz I., Saher N., Ul-Rehman M., Shahzad F., Nawaz S.A.,""57338786200";57201556257;56428654000;55822763900;57212166474;35243423400;56236817100;26039467900;57222556503;",Extraction of Psychological Effects of COVID-19 Pandemic through Topic-Level Sentiment Dynamics"",2022,""Complexity"",""2022"",,""9914224"","""","""",,,""10.1155/2022/9914224"",""https://www.scopus.com/inward/record.uri?eid=2-s2.0-85127460643&doi=10.1155%2f2022%2f9914224&partnerID=40&md5=aa48257add85ce79d29383cc05fedd9f"",""The rapid increase in COVID-19 cases has become the symbol of fear, anxiety, and panic among people around the globe. Mass media has played an active role in community education by addressing the health information of this pandemic. People interact by sharing their ideas and feelings through social media platforms. There is a considerable need to implement different measures and better perceive COVID-19 pertinent facts and information by demystifying public sentiments. In this study, the Quarantine Life dataset of thousand tweets is based on #Quarantine, #Quarantine Days, #Quarantine Life, #My Pandemic Plan, and #Quarantine and Chill from January to September 2020 has been collected from Twitter. The extracted data have been scrubbed through preprocessing techniques. The sentiments and topics extracted from tweets have been analyzed through the TEXT BLOB, VADER, and AFFIN approach. Results show that people were distressed and fearful due to the COVID-19 pandemic. However, most people enjoyed by playing games, watching movies, and reading books during the lockdown period. According to the present meta-Analysis, physical activity interventions are beneficial for patients with dementia in terms of cognition. The proposed framework illustrates the insight impact of COVID-19 on human physiological and mainly focuses on the evaluation of sentiment dynamics at the topical level. © 2022 Abdul Razzaq et al."",Article,""Final"",""All Open Access, Gold"",Scopus,2-s2.0-85127460643"
"Alzanin S.M., Azmi A.M., Aboalsamh H.A.,""56201078200";6603711563;6508339935;",Short text classification for Arabic social media tweets"",2022,""Journal of King Saud University - Computer and Information Sciences"",,,,"""","""",,,""10.1016/j.jksuci.2022.03.020"",""https://www.scopus.com/inward/record.uri?eid=2-s2.0-85127347590&doi=10.1016%2fj.jksuci.2022.03.020&partnerID=40&md5=1c4ea35e2cbbca6828394c51ac225fe1"",""With the rapid growth in the number of tweets published daily on Twitter, automated classification of tweets becomes necessary for broad diverse applications (e.g., information retrieval, topic labeling, sentiment analysis, rumors detection) to better understand what these tweets are, and what the users are expressing in this social platform. Text classification is the process of assigning one or more pre-defined categories to text according to its content. Tweets are short, and the short text does not have enough contextual information, which is part of the challenge in their classification. Adding to the challenge is the increase in ambiguity since the diacritical marking is not explicitly specified in most Modern Standard Arabic (MSA) texts. Not to mention the Arabic tweets are known to contain fused text of MSA and dialectal Arabic. In this paper, we propose a scheme to classify the textual tweets in the Arabic language based on its linguistic characteristics and content into five different categories. We explore two different textual representations: word embedding using Word2vec and stemmed text with term frequency-inverse document frequency (tf-idf). We tested three different classifiers: Support Vector Machine (SVM), Gaussian Naive Bayes (GNB), and Random Forest (RF). All the classifiers had their hyperparameters tuned. We collected and manually annotated a dataset of approximately 35,600 Arabic tweets for the experiments. Statistically, the RF and the SVM with radial basis function (RBF) kernel performed equally well when used with stemming and tf-idf, achieving macro-F1 scores ranging between 98.09% and 98.14%. The GNB with word embedding was disappointingly low performer. Our result tops the current state-of-the-art score of 92.95% using a deep learning approach, RNN-GRU (recurrent neural network-gated recurrent unit). © 2022 The Authors"",Article,""Article in Press"",""All Open Access, Gold"",Scopus,2-s2.0-85127347590";;;;;;
"Elayan S., Sykora M., Jackson T.W., Onojeharho E.,""55912344400";15061787500;7401595700;57205185679;",‘Are you having a laugh?’: detecting humorous expressions on social media: an exploration of theory, current approaches and future work"",2022,""International Journal of Information Technology and Management"",""21"",""1"",,""115"",""137"",,,""10.1504/IJITM.2022.121332"",""https://www.scopus.com/inward/record.uri?eid=2-s2.0-85127024843&doi=10.1504%2fIJITM.2022.121332&partnerID=40&md5=2c8460d58e740912035d7bca9fdefaf0"",""The role of humorous content on social media has rarely been taken into account in prior work. Understanding its dynamics on social media provides insight that could benefit a range of applications in sentiment analysis. This paper introduces literature on humour theory, related human behaviour and a discussion of existing automated approaches to humour detection. We present and review current research on humorous language use on social media and its significance. In particular, example humorous expressions from Twitter are used to illustrate the heterogeneous types of humour on social media. Since most prior work focused on English language contexts, the analysed example uses of humour are set in the Arabic cultural context, providing a novel view. The primary contribution of this paper is the position that similar to sentiment analysis, automated humour detection in its own right has potential in understanding public reactions and should be explored in future studies. Copyright © The Author(s) 2021. Published by Inderscience Publishers Ltd. Published by Inderscience Publishers Ltd."",Article,""Final"",""All Open Access, Hybrid Gold, Green"",Scopus,2-s2.0-85127024843";;;;;
"Khan Y., Thakur S., Obiyemi O., Adetiba E.,""57206657345";57225463819;55602626400;36175331700;",Exploring Links between Online Activism and Real-World Events: A Case Study of the #FeesMustFall"",2022,""Scientific Programming"",""2022"",,""1562592"","""","""",,,""10.1155/2022/1562592"",""https://www.scopus.com/inward/record.uri?eid=2-s2.0-85126968571&doi=10.1155%2f2022%2f1562592&partnerID=40&md5=a687a6f2a5be21277b989b2dda4ab7e9"",""The declaration of free education for the poor and working class by the South African government remains a key result of the two-year #FeesMustFall movement. The campaign was tainted by a few heinous incidents that sought to disrupt its objectives. This study examines the connections between online activism and real-world occurrences by undertaking a longitudinal sentiment analysis of textual conversations on the Twitter platform since no quantitative research has been documented in this regard, particularly on the opinions of social media users and their associated impacts. Between October 15, 2015, and April 10, 2017, 576,583 tweets with the hashtag campaign #FeesMustFall were collected and analyzed using the Valence Aware Dictionary Sentiment Reasoner (VADER). The change point analysis (CPA) method was used to detect various changes in the dataset, and the cumulative sum analysis (CUSUM) method was used to discover changes over time. Results revealed that this online activism sentiment reacted to and reflected real-life events. The sentiment expressed is triangulated with a perceived real-life negative event, which is the burning of the University of Johannesburg (UJ) hall and the library at the University of KwaZulu-Natal (UKZN), thus confirming how Internet activism influenced these real-world events during the #FeesMustFall campaign. The study makes a significant contribution because it is the first longitudinal examination of the #FeesMustFall campaign's sentiment distribution and variations. © 2022 Yaseen Khan et al."",Article,""Final"",""All Open Access, Gold"",Scopus,2-s2.0-85126968571";;;;;
"Liu C., Tan X., Zhou T., Zhang W., Liu J., Lu X.,""57194156923";11641113500;57217138109;57206984928;56120930800;57191611185;",Emoji use in China: popularity patterns and changes due to COVID-19"",2022,""Applied Intelligence"",,,,"""","""",,,""10.1007/s10489-022-03195-y"",""https://www.scopus.com/inward/record.uri?eid=2-s2.0-85126799282&doi=10.1007%2fs10489-022-03195-y&partnerID=40&md5=e3b251eab98f3e5807a86f21d61358f8"",""Emojis are small pictograms that are frequently embedded within micro-texts to more directly express emotional meanings. To understand the changes in the emoji usage of internet users during the COVID-19 outbreak, we analysed a large dataset collected from Weibo, the most popular Twitter-like social media platform in China, from December 1, 2019, to March 20, 2020. The data contained 38,183,194 microblog posts published by 2,239,472 unique users in Wuhan. We calculated the basic statistics of users’ usage of emojis, topics, and sentiments and analysed the temporal patterns of emoji occurrence. After examining the emoji co-occurrence structure, we finally explored other factors that may affect individual emoji usage. We found that the COVID-19 outbreak greatly changed the pattern of emoji usage";" i.e., both the proportion of posts containing emojis and the ratio of users using emojis declined substantially, while the number of posts remained the same. The daily proportion of Happy emojis significantly declined to approximately 32%, but the proportions of Sad- and Encouraging-related emojis rose to 24% and 34%, respectively. Despite a significant decrease in the number of nodes and edges in the emoji co-occurrence network, the average degree of the network increased from 34 to 39.8, indicating that the diversity of emoji usage increased. Most interestingly, we found that male users were more inclined towards using regular textual language with fewer emojis after the pandemic, suggesting that during public crises, male groups appeared to control their emotional display. In summary, the COVID-19 pandemic remarkably impacted individual sentiments, and the normal pattern of emoji usage tends to change significantly following a public emergency. © 2022, The Author(s), under exclusive licence to Springer Science+Business Media, LLC, part of Springer Nature."",Article,""Article in Press"",""All Open Access, Bronze, Green"",Scopus,2-s2.0-85126799282";;
"Sufi F.K., Alsulami M.,""15844339600";56534184700;",AI-based Automated Extraction of Location-Oriented COVID-19 Sentiments"",2022,""Computers, Materials and Continua"",""72"",""2"",,""3631"",""3649"",,2,""10.32604/cmc.2022.026272"",""https://www.scopus.com/inward/record.uri?eid=2-s2.0-85126583163&doi=10.32604%2fcmc.2022.026272&partnerID=40&md5=36e7e823a32fb5d63eaccc1139f600d1"",""The coronavirus disease (COVID-19) pandemic has affected the lives of social media users in an unprecedentedmanner. They are constantly posting their satisfaction or dissatisfaction over the COVID-19 situation at their location of interest. Therefore, understanding location-oriented sentiments about this situation is of prime importance for political leaders, and strategic decision-makers. To this end, we present a new fully automated algorithm based on artificial intelligence (AI), for extraction of location-oriented public sentiments on the COVID-19 situation. We designed the proposed system to obtain exhaustive knowledge and insights on social media feeds related to COVID-19 in 110 languages through AI-based translation, sentiment analysis, location entity detection, and decomposition tree analysis. We deployed fully automated algorithm on live Twitter feed from July 15, 2021 and it is still running as of 12 January, 2022. The system was evaluated on a limited dataset between July 15, 2021 to August 10, 2021. During this evaluation timeframe 150,000 tweets were analyzed and our algorithm found that 9,900 tweets contained one or more location entities. In total, 13,220 location entities were detected during the evaluation period, and the rates of average precision and recall rate were 0.901 and 0.967, respectively. As of 12 January, 2022, the proposed solution has detected 43,169 locations using entity recognition. According to the best of our knowledge, this study is the first to report location intelligence with entity detection, sentiment analysis, and decomposition tree analysis on social media messages related to COVID-19 and has covered the largest set of languages. © 2022 Tech Science Press. All rights reserved."",Article,""Final"",""All Open Access, Gold"",Scopus,2-s2.0-85126583163";;;;;;;
"Chinnaiah V., Kiliroor C.C.,""26424088500";57195064717;",Heterogeneous Feature Analysis on Twitter Data Set for Identification of Spam Messages"",2022,""International Arab Journal of Information Technology"",""19"",""1"",,""38"",""44"",,,""10.34028/iajit/19/1/5"",""https://www.scopus.com/inward/record.uri?eid=2-s2.0-85126489962&doi=10.34028%2fiajit%2f19%2f1%2f5&partnerID=40&md5=dbda8e59432f0c2aa5c6e90edaca9323"",""Spam is an undesirable content that present on online social networking sites, while spammers are the users who post this content on social networking sites. Unwanted messages posted on Twitter may have several goals and the spam tweets can interfere with statistics presented by Twitter mining tools and squander users’ attention.. Since Twitter has achieved a lot of attractiveness through-out the world, the interest towards it by the spammers and malevolent users is also increases. To overcome the spam problems many researchers proposed ideas using machine learning algorithms for the identification of spam messages. Not only the selection of classifiers but also the variegated feature analysis is essential for the identification of irrelevant messages in social networks. The proposed model performs a heterogeneous feature analysis on the twitter data streams for classifying the unsolicited messages using binary and continuous feature extraction with sentiment analysis on social network datasets. The features created are assessed using significant stratagems and the finest features are selected. A classifier model is built using these feature vectors to predict and identify the spam messages in Twitter. The experimental results clearly show that the proposed Sentiment Analysis based Binary and Continuous Feature Extraction model with Random Forest (SA-BC-RF) approach classifies the spam messages from the social networks with an accuracy of 90.72% when compared with the other state-of-the-art methods. © 2022, Zarka Private University. All rights reserved."",Article,""Final"",""All Open Access, Bronze"",Scopus,2-s2.0-85126489962";;;;;;;
"Elbasani E., Kim J.-D.,""56414984600";7601370103;",AMR-CNN: Abstract Meaning Representation with Convolution Neural Network for Toxic Content Detection"",2022,""Journal of Web Engineering"",""21"",""3"",,""677"",""692"",,,""10.13052/jwe1540-9589.2135"",""https://www.scopus.com/inward/record.uri?eid=2-s2.0-85126470139&doi=10.13052%2fjwe1540-9589.2135&partnerID=40&md5=383e290015655e458fe86ced4516b151"",""Recognizing the offensive, abusive, and profanity of multimedia content on the web has been a challenge to keep the web environment for user s freedom of speech. As profanity filtering function has been developed and applied in text, audio, and video context in platforms such as social media, entertainment, and education, the number of methods to trick the web-based application also has been increased and became a new issue to be solved. Compared to commonly developed toxic content detection systems that use lexicon and keyword-based detection, this work tries to embrace a different approach by the meaning of the sentence. Meaning representation is a way to grasp the meaning of linguistic input. This work proposed a data-driven approach utilizing Abstract meaning Representation to extract the meaning of the online text content into a convolutional neural network to detect level profanity. This work implements the proposed model in two kinds of datasets from the Offensive Language Identification Dataset and other datasets from the Offensive Hate dataset merged with the Twitter Sentiment Analysis dataset. The results indicate that the proposed model performs effectively, and can achieve a satisfactory accuracy in recognizing the level of online text content toxicity. © 2022 River Publishers. All rights reserved."",Article,""Final"",""All Open Access, Bronze"",Scopus,2-s2.0-85126470139";;;;;;;
"Karađuzović-Hadžiabdić K., Spahić R., Tahirović E.,""55601026300";57205581722;57528644100;",Evaluation of IBM Watson Natural Language Processing Service to predict influenza-like illness outbreaks from Twitter data"",2022,""Periodicals of Engineering and Natural Sciences"",""10"",""1"",,""122"",""137"",,,""10.21533/pen.v10i1.2454"",""https://www.scopus.com/inward/record.uri?eid=2-s2.0-85125645441&doi=10.21533%2fpen.v10i1.2454&partnerID=40&md5=44b815d641833881a895937a1ce63bf3"",""Social media has opened the gates for collecting big data that can be used to monitor epidemic trends in real time. We evaluate whether Watson NLP service can be used to reliably predict infectious disease such as influenza-like illness (ILI) outbreaks using Twitter data during the period of the main influenza season. Watson’s performance is evaluated by computing Pearson correlation between the number of tweets classified by Watson as ILI and the number of ILI occurrences recovered from traditional epidemic surveillance system of the Centers for Disease Control and Prevention (CDC). Achieved correlation was 0.55. Furthermore, a 12 week discrepancy was found between peak occurrences of ILI predicted by Watson and CDC reported data. Additionally, we developed a scoring method for ILI prediction from Twitter posts using a simple formula with the ability to predict ILI two weeks ahead of CDC reported ILI data. The method uses Watson’s sentiment and emotion scores together with identified ILI features to analyze influenza-related posts in real time. Due to Watson's high computational costs of sentiment and emotion analysis, we tested if machine learning approach can be used to predict influenza using only identified ILI keywords as influenza predictors. All three evaluated methods (Random Forest, Logistic Regression, K-NN), achieved overall accuracy of ~68.2% and 97.5% respectively, when Watson and the developed formula are used as medical experts. The obtained results suggest that data found within social media can be used to supplement the traditional surveillance of influenza outbreaks with the help of intelligent computations. © 2022, Periodicals of Engineering and Natural Sciences. All rights reserved."",Article,""Final"",""All Open Access, Gold"",Scopus,2-s2.0-85125645441";;;;;;
"Folgado M.G., Sanz V.,""57203842235";7004910942;",Exploring the political pulse of a country using data science tools"",2022,""Journal of Computational Social Science"",,,,"""","""",,,""10.1007/s42001-021-00157-1"",""https://www.scopus.com/inward/record.uri?eid=2-s2.0-85125516540&doi=10.1007%2fs42001-021-00157-1&partnerID=40&md5=8664844935ebb6af7bec72ae34f34a8f"",""In this paper we illustrate the use of Data Science techniques to analyse complex human communication. In particular, we consider tweets from leaders of political parties as a dynamical proxy to political programmes and ideas. We also study the temporal evolution of their contents as a reaction to specific events. We analyse levels of positive and negative sentiment in the tweets using new tools adapted to social media. We also train a Fully-Connected Neural Network (FCNN) to recognise the political affiliation of a tweet. The FCNN is able to predict the origin of the tweet with a precision in the range of 71–75%, and the political leaning (left or right) with a precision of around 90%. This study is meant to be viewed as an example of how to use Twitter data and different types of Data Science tools for a political analysis. © 2022, The Author(s)."",Article,""Article in Press"",""All Open Access, Hybrid Gold, Green"",Scopus,2-s2.0-85125516540";;;;;;;
"Yin H., Song X., Yang S., Li J.,""57215563331";57218316338;57193892869;57196717102;",Sentiment analysis and topic modeling for COVID-19 vaccine discussions"",2022,""World Wide Web"",,,,"""","""",,,""10.1007/s11280-022-01029-y"",""https://www.scopus.com/inward/record.uri?eid=2-s2.0-85125172208&doi=10.1007%2fs11280-022-01029-y&partnerID=40&md5=2f769c8a23fa6aa4ce808fcef791b8e7"",""The outbreak of the novel coronavirus disease (COVID-19) has been ongoing for almost two years and has had an unprecedented impact on the daily lives of people around the world. More recently, the emergence of the Delta variant of COVID-19 has once again put the world at risk. Fortunately, many countries and companies have developed vaccines for the coronavirus. As of 23 August 2021, more than 20 vaccines have been approved by the World Health Organization (WHO), bringing light to people besieged by the pandemic. The global rollout of the COVID-19 vaccine has sparked much discussion on social media platforms, such as the effectiveness and safety of the vaccine. However, there has not been much systematic analysis of public opinion on the COVID-19 vaccine. In this study, we conduct an in-depth analysis of the discussions related to the COVID-19 vaccine on Twitter. We analyze the hot topics discussed by people and the corresponding emotional polarity from the perspective of countries and vaccine brands. The results show that most people trust the effectiveness of vaccines and are willing to get vaccinated. In contrast, negative tweets tended to be associated with news reports of post-vaccination deaths, vaccine shortages, and post-injection side effects. Overall, this study uses popular Natural Language Processing (NLP) technologies to mine people’s opinions on the COVID-19 vaccine on social media and objectively analyze and visualize them. Our findings can improve the readability of the confusing information on social media platforms and provide effective data support for the government and policy makers. © 2022, The Author(s)."",Article,""Article in Press"",""All Open Access, Hybrid Gold, Green"",Scopus,2-s2.0-85125172208";;;;;
